StartDate,EndDate,Finished,Due Date,Treatment group,DateTaken,Enrolled,Q4#1,Q4#2,Baby's age at survey (weeks),baby DOB,Number of people working for employer,Length of time working at job,Hours usually worked per week when 6-7 months pregnant,Q6#1,Had any prenatal care,Number of weeks pregnant at first prenatal care visit (weeks),Cut back hours toward end of pregnancy?,Stop working before delivery?,Date when stopped working completely before delivery,Reasons took antenatal leave--Thought the baby might come early...21,Reasons took antenatal leave--To prepare for the birth of my child...22,Reasons took antenatal leave--Laid off as a result of pregnancy...23,Reasons took antenatal leave--Laid off for another reason...24,Reasons took antenatal leave--could collect pregnancy disability through SDI...25,Reasons took antenatal leave--Medical complications due to pregnancy...26,Reasons took antenatal leave--Difficulty carrying out work due to pregnancy,Reasons took antenatal leave-- commute to work too long...28,Reasons took antenatal leave--wanted to rest before the baby came...29,Reasons took antenatal leave--thought it would be better for baby's health...30,Reasons took antenatal leave--Other...31,Reasons took antenatal leave—Other--TEXT,Reasons took antenatal leave--MAIN reason,Antenatal leave paid?,Source of antenatal leave pay-- sick days...35,Source of antenatal leave pay-- vacation time...36,Source of antenatal leave pay--PTO...37,Source of antenatal leave pay-- private disability insurance...38,Source of antenatal leave pay--employer gave extra paid time off for maternity leave...39,Source of antenatal leave pay--SDI...40,Total number of weeks of paid antenatal leave,"Reasons decided to work through pregnancy, up until delivery--felt good...42","Reasons decided to work through pregnancy, up until delivery--wanted more time with baby after birth...43","Reasons decided to work through pregnancy, up until delivery--employer did not offer maternity leave...44","Reasons decided to work through pregnancy, up until delivery--needed the money...45","Reasons decided to work through pregnancy, up until delivery--was worried might lose my job if took leave...46","Reasons decided to work through pregnancy, up until delivery--afraid taking leave would hurt opportunities for advancement...47","Reasons decided to work through pregnancy, up until delivery—didn't know could take maternity leave before baby was born","Reasons decided to work through pregnancy, up until delivery--had baby early before planned leave could start...49","Reasons decided to work through pregnancy, up until delivery--no one to cover for me at work...50","Reasons decided to work through pregnancy, up until delivery--Other...51",Q6#12_9_TEXT,"Reasons decided to work through pregnancy, up until delivery--MAIN reason",Satisfaction with amount of antenatal leave,Q7#1,Took postpartum leave?,Returned to work?,Date returned to work,Plan on returning to same employer? (if not yet returned to work),Date plan to return to work,Reasons influencing amount of postpartum leave--collect pregnancy disability pay through SDI...61,Reasons influencing amount of postpartum leave-- employer offered maternity leave benefits...62,Reasons influencing amount of postpartum leave--wanted more time to breastfeed baby...63,Reasons influencing amount of postpartum leave--wanted more bonding time with baby...64,Reasons influencing amount of postpartum leave--wanted to save on child care costs...65,Reasons influencing amount of postpartum leave--wanted to return to work...66,Reasons influencing amount of postpartum leave--employer wanted me to return to work...67,Reasons influencing amount of postpartum leave--couldn't afford to take more time off...68,Reasons influencing amount of postpartum leave--Other...69,Reasons influencing amount of postpartum leave—Other--TEXT,Postpartum leave paid?,Total number of weeks of paid postpartum leave(returned to work),Source of postpartum leave pay-- sick days...73,Source of postpartum leave pay-- vacation time...74,Source of postpartum leave pay-- PTO...75,Source of postpartum leave pay-- private disability insurance...76,Source of postpartum leave pay--employer gave extra paid time off for maternity leave...77,Source of postpartum leave pay--SDI...78,Total number of weeks of paid postpartum leave expected(not yet returned to work),Satisfaction with amount of postpartum leave(returned to work),Satisfaction with amount of postpartum leave at this point (not yet returned to work),Q8#1,Number of pregnancies (includes most recent),Number of births (includes most recent),Singleton or multiple birth?,Number of babies gave birth to (if multiple),Birthweight (pounds) (singleton),Birthweight (ounces) (singleton),Birthweight (pounds) (multiple 1),Birthweight (ounces) (multiple 1),Birthweight (pounds) (multiple 2),Birthweight (ounces) (multiple 2),Birthweight (pounds) (multiple 3),Birthweight (ounces) (multiple 3),Birthweight (pounds) (multiple 4),Birthweight (ounces) (multiple 4),Birthweight (pounds) (multiple 5),Birthweight (ounces) (multiple 5),Birthweight (pounds) (multiple 6),Birthweight (ounces) (multiple 6),Birthweight (pounds) (multiple 7),Birthweight (ounces) (multiple 7),Type of birth,Health care provider induced labor?,Induction planned or emergency?,Q9#1,Health effects of antenatal leave (knowledge question),Health effects of postpartum leave (knowledge question),Number of weeks of antenatal leave usually paid by SDI (knowledge question),Types of job-protected maternity leave in California (knowledge question),True or False: Taking paid antenatal leave through SDI decreases amount of paid postpartum leave,True or False: You must work full time to qualify for paid maternity leave through SDI,True or False: You only qualify for paid maternity leave through SDI if pay into it through job,Q10#1,"Source of information about maternity leave--From friends, family, or co-workers...115",Source of information about maternity leave-- From doctor...116,Source of information about maternity leave-- From employer/human resources...117,Source of information about maternity leave-- From the internet...118,"Source of information about maternity leave-- From TV, radio or newspapers...119",Source of information about maternity leave-- From written materials...120,Source of information about maternity leave-- From written materials--TEXT,Source of information about maternity leave--Other...122,Source of information about maternity leave--Other --TEXT,Source of information about maternity leave--didn't get any information about maternity leave...124,"When planning maternity leave, able to find all information needed about the health benefits of taking antenatal or postpartum leave?","When planning maternity leave, able to find all information needed about laws that protect your job during maternity leave?","When planning maternity leave, able to find all information needed about ways to get paid during maternity leave?","When planning maternity leave, able to find all information needed about what happens with the health insurance and other benefits through employer during maternity leave?","When planning maternity leave, able to find all information needed about--Other","When planning maternity leave, able to find all information needed about--Other --TEXT",Best time to give pregnant women information about maternity leave,Q11#1,Remember getting tool?,Read or referred to tool?,Number of many times looked at tool,Tool easy to understand?,Usefulness of tool,Most useful thing about the tool (if thought it useful),Referred to the tool to find answers to questions?,Learn anything new from tool?,One thing learned from tool,Did tool help you plan maternity leave?,One way tool helped you plan maternity leave,Did you change your maternity leave plans based on information from tool?,Took tool to any meeting with employer/HR or doctor?,Called any phone numbers or visit any websites listed on tool?,One thing recommend we change to make tool more useful,"BEFORE received tool, how much knew about maternity leave?",Q12#1,Self-reported race/ethnicity--White or Caucasian...150,Self-reported race/ethnicity--Black or African American...151,Self-reported race/ethnicity--Latino or Hispanic...152,Self-reported race/ethnicity--Asian...153,Self-reported race/ethnicity--Other--TEXT,Born in U_S?,Years lived in US,Highest level of education completed,Highest level of education completed--TEXT,Marital status,Household income,Due_Datereadin,Q4_4readin,Q6_6readin,Q7_4readin,Q7_7readin,Self-reported race/ethnicity--American Indian or Alaskan Native...166,Self-reported race/ethnicity--Other Pacific Islander...167,Self-reported race/ethnicity--Native Hawaiian...168,Self-reported race/ethnicity--Other...169,baby's age when returned to work (weeks),Did tool answer question?,V8,V9,V10,Q11#2,Q11#3,Q11#4,Q11#5,Q11#6,Q11#7,Q11#8,Q11#9,Q11#10,Q11#11,Q11#12,Q11#13,Q11#14,Q11#15,Q11#16,Q11#17,Q11#18,Tool easy to understand? (DIDN'T READ BEFOREHAND),Usefulness of tool (DIDN'T READ BEFOREHAND),Most useful thing about the tool (if thought it useful) (DIDN'T READ BEFOREHAND),handout answer any questions you've had? (DIDN'T READ BEFOREHAND),Learn anything new from tool? (DIDN'T READ BEFOREHAND),One thing learned from tool (DIDN'T READ BEFOREHAND),Would tool have helped you plan maternity leave? (DIDN'T READ BEFOREHAND),Would have taken tool to any meeting with employer/HR or doctor? (DIDN'T READ BEFOREHAND),Would have called any phone numbers or visit any websites listed on tool? (DIDN'T READ BEFOREHAND),One thing recommend we change to make tool more useful (DIDN'T READ BEFOREHAND),"BEFORE received tool, how much knew about maternity leave? (DIDN'T READ BEFOREHAND)",Enrolled in study at OB/GYN office prior to change to online enrollment (not randomized),Mother's age at enrollment in study,"Weeks pregnant at enrollment in study (categorical, self-report)",Where heard about study,Q1#9_TEXT,Number of paid weeks postpartum leave (combined for those returned and not yet returned to work),Satisfaction with amount of postpartum leave (combined for those returned and not yet returned to work),Date return to work (combined for those returned and not yet returned to work),Birthweight in grams,Low birthweight (<2500 g),Weeks late or early,Weeks gestation at birth,Preterm birth (<37 weeks gestation),Date enrolled in study,Weeks pregnant when enrolled in study,Weeks pregnant when began antenatal leave,Weeks of antenatal leave,intendedantelv,Weeks of postpartum leave,Health effects of antenatal leave (knowledge question)--CORRECT?,Health effects of postpartum leave (knowledge question)--CORRECT?,Number of weeks of antenatal leave usually paid by SDI (knowledge question)--CORRECT?,Types of job-protected maternity leave in California (knowledge question)--CORRECT?,True or False: Taking paid antenatal leave through SDI decreases amount of paid postpartum leave--CORRECT?,True or False: You must work full time to qualify for paid maternity leave through SDI--CORRECT?,True or False: You only qualify for paid maternity leave through SDI if pay into it through job--CORRECT?,total number of correct answers to knowledge questions,percent of knowledge questions answered correctly,Highest level of education completed (collapsed),Categorical age variable,Trimester entered into prenatal care,Trimester enrolled in study,numpregs,numbirths,educcat,inccat,hourscoll,Self-reported race/ethnicity--Asian...240,"Source of information about maternity leave-- From TV, radio or newspapers...241",Source of information about maternity leave--Other...242,Source of information about maternity leave--didn't get any information about maternity leave...243,Self-reported race/ethnicity--White or Caucasian...244,Self-reported race/ethnicity--Black or African American...245,Self-reported race/ethnicity--Latino or Hispanic...246,Self-reported race/ethnicity--American Indian or Alaskan Native...247,Self-reported race/ethnicity--Other Pacific Islander...248,Self-reported race/ethnicity--Native Hawaiian...249,Self-reported race/ethnicity--Other...250,"Source of information about maternity leave--From friends, family, or co-workers...251",Source of information about maternity leave-- From doctor...252,Source of information about maternity leave-- From employer/human resources...253,Source of information about maternity leave-- From the internet...254,Source of information about maternity leave-- From written materials...255,Reasons took antenatal leave--Laid off as a result of pregnancy...256,Reasons took antenatal leave--could collect pregnancy disability through SDI...257,Reasons took antenatal leave--Medical complications due to pregnancy...258,Reasons took antenatal leave--Laid off for another reason...259,Reasons took antenatal leave--Thought the baby might come early...260,Reasons took antenatal leave--To prepare for the birth of my child...261,Reasons took antenatal leave--Difficulty in carrying out work due to pregnancy,Reasons took antenatal leave-- commute to work too long...263,Reasons took antenatal leave--wanted to rest before the baby came...264,Reasons took antenatal leave--thought it would be better for baby's health...265,Reasons took antenatal leave--Other...266,"Reasons decided to work through pregnancy, up until delivery--employer did not offer maternity leave...267","Reasons decided to work through pregnancy, up until delivery--needed the money...268","Reasons decided to work through pregnancy, up until delivery--was worried might lose my job if took leave...269","Reasons decided to work through pregnancy, up until delivery--afraid taking leave would hurt opportunities for advancement...270","Reasons decided to work through pregnancy, up until delivery—didn’t know could take maternity leave before baby was born","Reasons decided to work through pregnancy, up until delivery--Other...272","Reasons decided to work through pregnancy, up until delivery--felt good...273","Reasons decided to work through pregnancy, up until delivery--wanted more time with baby after birth...274","Reasons decided to work through pregnancy, up until delivery--had baby early before planned leave could start...275","Reasons decided to work through pregnancy, up until delivery--no one to cover for me at work...276",Source of antenatal leave pay-- sick days...277,Source of antenatal leave pay--PTO...278,Source of antenatal leave pay-- private disability insurance...279,Source of antenatal leave pay--SDI...280,Source of antenatal leave pay-- vacation time...281,Source of antenatal leave pay--employer gave extra paid time off for maternity leave...282,Reasons influencing amount of postpartum leave--Other...283,Reasons influencing amount of postpartum leave--collect pregnancy disability pay through SDI...284,Reasons influencing amount of postpartum leave-- employer offered maternity leave benefits...285,Reasons influencing amount of postpartum leave--wanted more time to breastfeed baby...286,Reasons influencing amount of postpartum leave--wanted more bonding time with baby...287,Reasons influencing amount of postpartum leave--wanted to save on child care costs...288,Reasons influencing amount of postpartum leave--wanted to return to work...289,Reasons influencing amount of postpartum leave--employer wanted me to return to work...290,Reasons influencing amount of postpartum leave--couldn't afford to take more time off...291,Source of postpartum leave pay-- vacation time...292,Source of postpartum leave pay-- PTO...293,Source of postpartum leave pay-- sick days...294,Source of postpartum leave pay-- private disability insurance...295,Source of postpartum leave pay--employer gave extra paid time off for maternity leave...296,Source of postpartum leave pay--SDI...297,q6_3,csection,readtool,babyageCALC,antelv1wk,reta8wks,gestational age (categorical),Treatment group (3 categories),Age (2 categories),Work part time (<31 hours) during pregnancy,notreadtool
2013-03-15T00:00:00Z,2013-03-15T00:00:00Z,1,2013-01-09T00:00:00Z,Control group,20121015,1,1,1,8,2013-01-16T00:00:00Z,50 or more,>1 year,More than 40 hours a week,1,Yes,10,Yes,"No, I worked up til time of delivery",NA,NA,NA,NA,NA,NA,NA,NA,NA,NA,NA,NA,NA,NA,NA,NA,NA,NA,NA,NA,NA,NA,1,1,NA,NA,NA,NA,NA,NA,NA,NA,NA,I felt good,Very satisfied,1,Yes,"Yes, I have gone back to work with the same employer",2013-03-15T00:00:00Z,NA,NA,1,1,1,1,NA,1,NA,NA,NA,NA,Yes,8,1,NA,NA,NA,NA,1,NA,Very satisfied,NA,1,1,1,One baby,NA,6,13,NA,NA,NA,NA,NA,NA,NA,NA,NA,NA,NA,NA,NA,NA,Vaginal,Yes,Planned ahead of time,1,All of the above,All of the above,2 weeks,Both Pregnancy Disability Leave and California Family Rights Act Leave,TRUE,I don't know,FALSE,1,1,NA,1,NA,NA,NA,NA,NA,NA,NA,Yes,Yes,Yes,Yes,NA,NA,First trimester,NA,NA,NA,NA,NA,NA,NA,NA,NA,NA,NA,NA,NA,NA,NA,NA,NA,1,1,NA,NA,NA,NA,Yes,NA,Graduate or professional school,NA,Married,"$50,000 - $74,999",NA,NA,NA,NA,NA,NA,NA,NA,NA,NA,NA,NA,NA,NA,NA,NA,NA,NA,NA,NA,NA,NA,NA,NA,NA,NA,NA,NA,NA,NA,NA,NA,NA,NA,NA,NA,NA,NA,NA,NA,NA,NA,NA,31,24-31 weeks,At my OB/GYN doctor's office,NA,8,Very satisfied,2013-03-15T00:00:00Z,3090.09,Not low birth weight,1,41,Full term birth,2012-10-15T00:00:00Z,27.7143,NA,NA,NA,8.2857,1,1,0,1,0,0,0,3,42.857,4 or more years college (College graduate) or more,30-39,1st trimester,2nd trimester,1,1,3,2,4,0,0,0,0,1,0,0,0,0,0,0,1,0,1,0,0,NA,NA,NA,NA,NA,NA,NA,NA,NA,NA,NA,0,0,0,0,0,0,1,1,0,0,NA,NA,NA,NA,NA,NA,0,1,1,1,1,0,1,0,0,0,0,1,0,0,1,NA,0,did not read tool,8.3708,0,1,40+ weeks,control,30+,worked 31+ hours,control or intervention who read tool
2013-02-22T00:00:00Z,2013-02-22T00:00:00Z,1,2012-12-04T00:00:00Z,Control group,20120818,1,1,1,11,2012-12-06T00:00:00Z,Fewer than 5,>1 year,21-30 hours a week,1,Yes,8,Yes,Yes,2012-11-20T00:00:00Z,NA,1,NA,NA,NA,NA,NA,NA,NA,NA,NA,NA,To prepare for the birth of my child,No,NA,NA,NA,NA,NA,NA,NA,NA,NA,NA,NA,NA,NA,NA,NA,NA,NA,NA,NA,Very satisfied,1,Yes,"Yes, I have gone back to work with the same employer",2013-02-05T00:00:00Z,NA,NA,NA,NA,1,1,NA,NA,NA,1,NA,NA,No,NA,NA,NA,NA,NA,NA,NA,NA,Somewhat satisfied,NA,1,1,1,One baby,NA,7,9,NA,NA,NA,NA,NA,NA,NA,NA,NA,NA,NA,NA,NA,NA,Vaginal,No,NA,1,I don't know,More time to learn how to breastfeed and pump breast milk,don't know,Paid Family Leave,TRUE,TRUE,TRUE,1,NA,NA,NA,1,NA,NA,NA,NA,NA,NA,No,No,Yes,No,NA,NA,First trimester,NA,NA,NA,NA,NA,NA,NA,NA,NA,NA,NA,NA,NA,NA,NA,NA,NA,1,1,NA,NA,NA,NA,Yes,NA,College 4 years or more (College graduate),NA,Married,"$30,000 - $49,999",NA,NA,NA,NA,NA,NA,NA,NA,NA,NA,NA,NA,NA,NA,NA,NA,NA,NA,NA,NA,NA,NA,NA,NA,NA,NA,NA,NA,NA,NA,NA,NA,NA,NA,NA,NA,NA,NA,NA,NA,NA,NA,NA,36,24-31 weeks,someonetold me about it,NA,NA,Somewhat satisfied,2013-02-05T00:00:00Z,3430.29,Not low birth weight,0.28571,40.2857,Full term birth,2012-08-18T00:00:00Z,24.5714,38,2.2857,2,8.7143,0,0,0,0,0,0,1,1,14.286,4 or more years college (College graduate) or more,30-39,1st trimester,2nd trimester,1,1,2,1,2,0,0,0,0,1,0,0,0,0,0,0,0,0,0,1,0,0,0,0,0,0,1,0,0,0,0,0,NA,NA,NA,NA,NA,NA,NA,NA,NA,NA,NA,NA,NA,NA,NA,NA,0,0,0,1,1,0,0,0,1,NA,NA,NA,NA,NA,NA,NA,0,did not read tool,11.2309,1,1,40+ weeks,control,30+,worked 1-30 hours,control or intervention who read tool
2013-01-10T00:00:00Z,2013-01-10T00:00:00Z,1,2012-12-10T00:00:00Z,Control group,20120920,1,1,1,5,2012-12-02T00:00:00Z,Between 5-49,>1 year,21-30 hours a week,1,Yes,6,No,Yes,2012-11-15T00:00:00Z,1,1,NA,NA,1,NA,1,NA,1,NA,NA,NA,Thought the baby might come early,Yes,NA,NA,NA,NA,NA,1,1,NA,NA,NA,NA,NA,NA,NA,NA,NA,NA,NA,NA,Very satisfied,1,Yes,"No, I haven't gone back to work yet, but I do plan to go back to work in the next year",NA,NA,NA,NA,NA,NA,1,NA,NA,NA,NA,NA,NA,Yes,NA,NA,NA,NA,NA,NA,1,12,NA,Somewhat dissatisfied,1,3,2,One baby,NA,6,14,NA,NA,NA,NA,NA,NA,NA,NA,NA,NA,NA,NA,NA,NA,Vaginal,No,NA,1,Lower risk for problems during your baby's birth,All of the above,4 weeks,Pregnancy Disability Leave,FALSE,TRUE,TRUE,1,1,1,NA,1,NA,NA,NA,NA,NA,NA,Yes,Yes,Yes,Yes,NA,NA,First trimester,NA,NA,NA,NA,NA,NA,NA,NA,NA,NA,NA,NA,NA,NA,NA,NA,NA,1,NA,NA,NA,NA,NA,Yes,NA,College 1 year to 3 years (Some college or technical school),NA,Married,"$100,000 - 149,999",NA,NA,NA,NA,NA,NA,1,NA,NA,NA,NA,NA,NA,NA,NA,NA,NA,NA,NA,NA,NA,NA,NA,NA,NA,NA,NA,NA,NA,NA,NA,NA,NA,NA,NA,NA,NA,NA,NA,NA,NA,NA,NA,33,24-31 weeks,from BerkeleyParents' Network,NA,12,Somewhat dissatisfied,NA,3118.44,Not low birth weight,-1.14286,38.8571,Full term birth,2012-09-20T00:00:00Z,28.4286,36.4286,2.4286,3.5714,NA,0,1,1,0,1,0,1,4,57.143,1-3 years college (Some college or technical school) or less,30-39,1st trimester,3rd trimester,2,2,1,4,2,0,0,0,0,0,0,0,0,1,0,0,1,1,0,1,0,0,1,0,0,1,1,1,0,1,0,0,NA,NA,NA,NA,NA,NA,NA,NA,NA,NA,0,0,0,1,0,0,0,0,0,0,1,0,0,0,0,0,0,0,0,0,1,NA,0,did not read tool,5.6322,1,NA,37 to <40 weeks,control,30+,worked 1-30 hours,control or intervention who read tool
2013-02-22T00:00:00Z,2013-02-22T00:00:00Z,1,2013-01-22T00:00:00Z,Control group,20121009,1,1,1,5,2013-01-18T00:00:00Z,50 or more,>1 year,31-40 hours a week,1,Yes,9,No,Yes,2012-12-24T00:00:00Z,1,1,NA,NA,1,NA,NA,NA,1,NA,NA,NA,To prepare for the birth of my child,Yes,NA,NA,NA,NA,NA,1,3,NA,NA,NA,NA,NA,NA,NA,NA,NA,NA,NA,NA,Very satisfied,1,Yes,"No, I haven't gone back to work yet, but I do plan to go back to work in the next year",NA,NA,2013-05-06T00:00:00Z,1,1,NA,1,NA,NA,NA,1,NA,NA,Yes,NA,1,NA,NA,NA,NA,1,12,NA,Somewhat satisfied,1,3,2,One baby,NA,7,11,NA,NA,NA,NA,NA,NA,NA,NA,NA,NA,NA,NA,NA,NA,Vaginal,No,NA,1,All of the above,All of the above,4 weeks,Both Pregnancy Disability Leave and California Family Rights Act Leave,FALSE,FALSE,I don't know,1,NA,NA,1,NA,NA,NA,NA,NA,NA,NA,Yes,Yes,Yes,NA,NA,NA,First trimester,NA,NA,NA,NA,NA,NA,NA,NA,NA,NA,NA,NA,NA,NA,NA,NA,NA,1,NA,NA,NA,1,NA,Yes,NA,College 4 years or more (College graduate),NA,Married,"$150,000 or more",NA,NA,NA,NA,NA,NA,NA,NA,NA,NA,NA,NA,NA,NA,NA,NA,NA,NA,NA,NA,NA,NA,NA,NA,NA,NA,NA,NA,NA,NA,NA,NA,NA,NA,NA,NA,NA,NA,NA,NA,NA,NA,NA,39,24-31 weeks,someonetold me about it,NA,12,Somewhat satisfied,NA,3486.99,Not low birth weight,-0.57143,39.4286,Full term birth,2012-10-09T00:00:00Z,25,35.8571,3.5714,4.1429,NA,1,1,1,1,1,1,0,6,85.714,4 or more years college (College graduate) or more,30-39,1st trimester,2nd trimester,2,2,2,5,3,1,0,0,0,0,0,0,0,0,0,0,0,0,1,0,0,0,1,0,0,1,1,0,0,1,0,0,NA,NA,NA,NA,NA,NA,NA,NA,NA,NA,0,0,0,1,0,0,0,1,1,0,1,0,0,0,1,0,0,1,0,0,1,NA,0,did not read tool,5.1117,1,NA,37 to <40 weeks,control,30+,worked 31+ hours,control or intervention who read tool
2013-04-10T00:00:00Z,2013-04-10T00:00:00Z,1,2013-01-05T00:00:00Z,Control group,20120920,1,1,1,13,2013-01-07T00:00:00Z,50 or more,>1 year,31-40 hours a week,1,Yes,8,Yes,Yes,2012-12-07T00:00:00Z,NA,1,NA,NA,1,NA,NA,NA,1,NA,NA,NA,I could collect pregnancy disability through the State Disability Insurance Program,Yes,1,NA,NA,NA,NA,1,4,NA,NA,NA,NA,NA,NA,NA,NA,NA,NA,NA,NA,Very satisfied,1,Yes,"Yes, I have gone back to work with the same employer",2013-02-19T00:00:00Z,NA,NA,1,NA,NA,NA,NA,NA,NA,1,NA,NA,Yes,6,NA,NA,NA,NA,NA,1,NA,Somewhat dissatisfied,NA,1,1,1,One baby,NA,7,0.2,NA,NA,NA,NA,NA,NA,NA,NA,NA,NA,NA,NA,NA,NA,Vaginal,No,NA,1,All of the above,All of the above,4 weeks,California Family Rights Act Leave,FALSE,FALSE,I don't know,1,1,1,1,1,NA,NA,NA,NA,NA,NA,No,Yes,No,No,NA,"The ways that different kinds of leave and pay could work together, including returning to work part time",Second trimester,NA,NA,NA,NA,NA,NA,NA,NA,NA,NA,NA,NA,NA,NA,NA,NA,NA,1,1,NA,NA,NA,NA,Yes,NA,Graduate or professional school,NA,Living with a partner,"$75,000 - $99,999",NA,NA,20121207,NA,NA,NA,NA,NA,NA,NA,NA,NA,NA,NA,NA,NA,NA,NA,NA,NA,NA,NA,NA,NA,NA,NA,NA,NA,NA,NA,NA,NA,NA,NA,NA,NA,NA,NA,NA,NA,NA,NA,NA,34,24-31 weeks,from BerkeleyParents' Network,NA,6,Somewhat dissatisfied,2013-02-19T00:00:00Z,3180.81,Not low birth weight,0.28571,40.2857,Full term birth,2012-09-20T00:00:00Z,24.7143,35.8571,4.4286,4.1429,6.1429,1,1,1,0,1,1,0,5,71.429,4 or more years college (College graduate) or more,30-39,1st trimester,2nd trimester,1,1,3,3,3,0,0,0,0,1,0,0,0,0,0,0,1,1,1,1,0,0,1,0,0,0,1,0,0,1,0,0,NA,NA,NA,NA,NA,NA,NA,NA,NA,NA,1,0,0,1,0,0,0,1,0,0,0,0,0,0,1,0,0,0,0,0,1,NA,0,did not read tool,13.3505,1,0,40+ weeks,control,30+,worked 31+ hours,control or intervention who read tool
2012-12-13T00:00:00Z,2012-12-13T00:00:00Z,1,2012-10-29T00:00:00Z,Control group,20120814,1,1,1,5,2012-11-08T00:00:00Z,50 or more,>1 year,31-40 hours a week,1,Yes,12,No,Yes,2012-10-16T00:00:00Z,NA,1,NA,NA,1,NA,NA,NA,1,1,NA,NA,To prepare for the birth of my child,No,NA,NA,NA,NA,NA,NA,NA,NA,NA,NA,NA,NA,NA,NA,NA,NA,NA,NA,NA,Very satisfied,1,Yes,"No, I haven't gone back to work yet, but I do plan to go back to work in the next year",NA,NA,2013-02-18T00:00:00Z,1,NA,1,1,NA,NA,NA,1,NA,NA,Yes,NA,1,1,1,NA,NA,NA,14,NA,Somewhat dissatisfied,1,1,1,One baby,NA,8,2,NA,NA,NA,NA,NA,NA,NA,NA,NA,NA,NA,NA,NA,NA,C-section needed at the last minute,Yes,Planned ahead of time,1,I don't know,All of the above,6 weeks,Both Pregnancy Disability Leave and California Family Rights Act Leave,FALSE,FALSE,I don't know,1,1,NA,1,1,NA,NA,NA,NA,NA,NA,No,Yes,Yes,No,NA,NA,First trimester,NA,NA,NA,NA,NA,NA,NA,NA,NA,NA,NA,NA,NA,NA,NA,NA,NA,1,1,NA,NA,NA,NA,Yes,NA,Grade 12 or GED (High school graduate),NA,Living with a partner,"$50,000 - $74,999",NA,NA,NA,NA,NA,NA,NA,NA,NA,NA,NA,NA,NA,NA,NA,NA,NA,NA,NA,NA,NA,NA,NA,NA,NA,NA,NA,NA,NA,NA,NA,NA,NA,NA,NA,NA,NA,NA,NA,NA,NA,NA,NA,30,24-31 weeks,At my OB/GYN doctor's office,NA,14,Somewhat dissatisfied,NA,3685.43,Not low birth weight,1.42857,41.4286,Full term birth,2012-08-14T00:00:00Z,29.1429,38.1429,3.2857,1.8571,NA,0,1,0,1,1,1,0,4,57.143,1-3 years college (Some college or technical school) or less,30-39,1st trimester,3rd trimester,1,1,1,2,3,0,0,0,0,1,0,0,0,0,0,0,1,0,1,1,0,0,1,0,0,0,1,0,0,1,1,0,NA,NA,NA,NA,NA,NA,NA,NA,NA,NA,NA,NA,NA,NA,NA,NA,0,1,0,1,1,0,0,0,1,1,1,1,0,0,0,NA,1,did not read tool,5.1074,1,NA,40+ weeks,control,30+,worked 31+ hours,control or intervention who read tool
